"2009-05-09T20:48:26Z"	"http://www.paralympics.org.uk/news.asp?itemid=1596&section=000100010006&sectionTitle=News&showdate=2008-8-1"	"News - The British Paralympic Association"	"News - The British Paralympic Association Fast find ... Jobs Library Parasport Features Jump to Seach Print View Newsletter Contact us Donate About the BPA Beijing Games 2008 ParalympicsGB Team Beijin"	"24:jqFontCm3lkPWI31XLgQ2Pbd56a+jFjklJ8v6L:jqK3lQvFXLoPbd5OjFjeBL"	"b13bb58f7f0b72644e14694022521dc2"
"2009-09-27T23:02:21Z"	"http://www.ravinewoodlife.org.uk/woodland_conservation/important_globally.asp"	"Woodland Conservation - Are Ravine Woodlands important globally?"	"Woodland Conservation - Are Ravine Woodlands important globally? Are Ravine Woodlands important globally? Ravine or Tilio-Acerion woodlands are found throughout Europe, and are widespread from Scandin"	"48:7tRxm/0mgSCVMTHG226sUIZWH/RjASwu4fGM4K:PsMmgSCVMTm2260Wf1yu4fG5K"	"ae176cec7564159286bac698f6af29e6"
"2009-11-23T19:06:21Z"	"http://www.ukbms.org/(S(c04em0453nrqrgzcnhl25145))/site3214/species88.htm"	"UKBMS - List of sites where this species occurs"	"UKBMS - List of sites where this species occurs Home ? Sites ? Cotom countryside reserve ? Large Skipper ? Large Skipper at Cotom countryside reserve Indices for Cotom countryside reserve compared wit"	"24:ymFFFKFf3KGPW9KgS3rg/P2CKyX1Z3qZb2+7L:xnef3KGPIJS7guyX1F+3"	"cd18c1cdda6e60a38b8292a04e7ec5a5"
"2009-11-01T23:23:05Z"	"http://liberalengland.blogspot.com/2009/08/brit-noir-season-reviewed.html"	"Liberal England: Brit Noir season reviewed"	"Liberal England: Brit Noir season reviewed.comment-link {margin-left:.6em;} Liberal England An amusingly eclectic mix of culture and politics from Jonathan Calder "Well written, funny and wistful" - P"	"96:EgN+N5hQwuuHU05BZOBvUmUpmAim+sHM2qkbU+c8cwo2Yct9i8YRSGeBg:DN+fh15BAB89MmHMBkbU5ct9E"	"3adc8b99eea9cca5fdd07c7124aa589b"
"2009-10-02T06:01:25Z"	"http://www.assemblywales.org/mrs071201_white_paper_on_energy_research_paper.pdf"	"Enquiry Blank"	"Enquiry Blank White Paper on Energy (May 2007) Abstract This research paper provides a short synopsis of the May 2007 White Paper on Energy June 2007 Members? Research Service / Gwasanaeth Ymchwil yr "	"768:VjFUru0Ga8k72J+gZAJ03f1qkOQ8u3e/ye+kLmYbqBAsCcLQ7DqP6WletWOK1RGC:VBUxt72AK1OFu3e/ye5/irliIRMPhviF"	"75d917fd933319202d6d45e241a6dac7"
"2009-07-24T09:43:20Z"	"http://www.bl.uk/projects/theatrearchive/mason5.html"	"The Theatre Archive Project - interviews - Marjery Mason - Page 5"	"The Theatre Archive Project - interviews - Marjery Mason - Page 5 ? Home Archives Scripts Interviews Related resources Contact us ? Search the Theatre Archive Project ? Interviews Marjery Mason Actres"	"192:o67EuFwa/4Lr2wkMOOKCFM5l4P4FUUSySTuP3vII3mgIbsaOI9e6VF5JPPC:vt4/2wXfKCgE4C/8vt2gSsZUF5FPC"	"b30bd6b770e1512656da840dac179aa0"
"2009-10-14T01:53:21Z"	"http://www.geograph.org.uk/sitemap/NJ/04/6/NJ0348.html"	"Photos in NJ0348 :: Geograph British Isles"	"Photos in NJ0348 :: Geograph British IslesGeograph British Isles Homepage | Sitemap | Up one level | Photos in NJ0348 :: Geograph British Isles NJ0348 :: Ruin by the trackside by the Moss of Dunphail "	"12:qiznSpHoyvzatmA9/zatYuZgvHtk0MmDHtnbPta6tGbDCx:qw8/vWtfhWtYlvHtkVitbPta6tGbDCx"	"af4d1a4845dc4db862ff6a9429b2684d"
"2009-05-12T09:09:17Z"	"http://www.25megroup.org/Newsletter/Issue%2023/AGM%20ITEMS/BALLOT%20PAPER%202%202007.doc"	"THE 25% ME GROUP"	"THE 25% ME GROUPThe 25% ME GROUP is an Unincorporated Association which is a Registered Charity. No. SC034265 BALLOT PAPER 2 MANAGEMENT COMMITTEE & OFFICE BEARERS ELECTIONS 25% ME GROUP (SUPPORT GROUP"	"96:RhEqfDPUksC3mNt2HWtDQy3EJT9JW/xEJn/cik+vEJWrX3B:Rh97mt26DQyQXfny3Wj3B"	"2e9c377db2ef5006b186f109fd20494c"
"2009-03-14T00:05:35Z"	"http://www.cadbury.com/careers/ukgraduaterecruitment/businessareas/salesandmarketing/Pages/stevechantry.aspx?printable=true&printable=true&printable=true"	""	" skip to content Contact us Cadbury worldwide Our Company Our Brands Our Responsibilities Investors Media Careers Working Here What Matters To Us Career Development Meet Our People Current Jobs UK Gra"	"48:u1vOdUm0g+tNQmpNq5qgmcxzNmaoYVdEgBO8VNQuuH/hxzNmaoYrN+eZ9mBNPviK:AvOUm0PtNoq7KNmPYH7B9h0NmPYrN7SX"	"2bba1e3be0cbe06e88d45c0e42013dab"
"2009-11-05T23:45:15Z"	"http://www.ancient-tree-hunt.org.uk/WoodlandTrust/Core/StyleSheet.aspx?siteName=www.ancient-tree-hunt.org.uk&pageName=LinkToPage&themePath=%2fWoodlandTrust%2fSites%2fAncientTreeHunt%2fTheme&subThemeName=StandardPrint&webAuthorMode=0&NRMODE=Published&WBCMODE=&NRNODEGUID=%7b53B8A0B9-EDAE-4615-8CAD-F44DBB279687%7d&channelCSS_0=Tab1&targetMedium=Screen"	""	"div.postingActionsContainer{position:relative;padding:10px 0 20px 10px;font-size:90%;}ul.postingActionsList{list-style:none;margin:0;padding:0;}ul.postingActionsList li a{display:block;text-decoration"	"192:zErM5Ij44rcggxgPWx9dYV+x+su1LH8xCvrkOuynvrvouYEKlooQpNbGLIu:zUB0iWX+tmK5bPYvlo1XGku"	"c59cef8aa16c916a6de11d2549690664"
"2009-06-15T12:23:19Z"	"http://www.freud.org.uk/archive/48622/detail/"	"The Freud Museum, at 20 Maresfield Gardens in Hampstead, London"	"The Freud Museum, at 20 Maresfield Gardens in Hampstead, London Search The Freud Museum Home About Visit Shop Exhibitions Education Photo Library Archives & Research Library Archive Catalogue Events &"	"12:a+jBRcPTLCLjseoseaLDXv5JyvQxeFZljQwkLZfElCjjF1:JRcPcyCbvOxFZ5QJZfElCjjF1"	"8c4262579cc6bce2398b3d990b67f05d"
"2009-12-06T06:25:16Z"	"http://elleeseymour.com/2007/01/17/could-obama-be-americas-first-black-president/"	"Ellee Seymour - MCIPR, PRESS CONSULTANT, JOURNALIST, POLITICAL AND PR BLOGGER. ? Could Obama be America?s first black president?"	"Ellee Seymour - MCIPR, PRESS CONSULTANT, JOURNALIST, POLITICAL AND PR BLOGGER. ? Could Obama be America?s first black president? Ellee Seymour MCIPR, PRESS CONSULTANT, JOURNALIST, POLITICAL AND PR BLO"	"384:SbxVHtqOowYKn/q9g8UWWfjCeOZ5gU/pJwsYUnzK2TTMuR1:SbLAwL/ljWW3OTgU/pJTjO2T/R1"	"cf94963be963a61211b0944f2a704746"
"2009-09-22T19:52:06Z"	"http://www.devonwildlifetrust.org/index.php?section=news:archive&id=1319"	"News Archive"	"News Archive Text only | A-Z Index | Contact Us Protecting Wildlife for the Future Home | About Us | Helping Us | WildSHOP | WildNEWS | Wildlife Havens Join Us | Kids | People & Wildlife | Wildlife Ch"	"96:xbJxHkxmjiqpp/+6cGn77nNiaKb2K+PBS3s:CxuvR+6c67pi+Zh"	"6c7f46c05528a100c0cdf838803aa8f0"
"2009-06-16T10:52:38Z"	"http://www.spinningtheweb.org.uk/sendpage.php?here=%2Fsendpage.php%3Fhere%3D%252Fpartners5.php"	"Spinning the Web > Email Page"	"Spinning the Web > Email Page You are in: Email Page > Print Page?Email Page? Fill out the form below to pass on the details of the page: Please fill in all the required fields * Recipient's name: * Y"	"6:f4lVAGKsRLAcwJNXpliFtJ+w68xmO4JlA+Fp+flE/AVCB5olLAVZxbWFkWF:fKzRAcwTX6SwXmFXA+Fp8E/W22NWKhF"	"3cb530a84d148aee6d0cc361ff4adac3"
"2009-02-18T04:28:26Z"	"http://www.pan-uk.org/pestnews/Issue/pn23/pn23p11b.htm"	"Pesticides Overboard - North Sea and Channel threat"	"Pesticides Overboard - North Sea and Channel threat Pesticides Overboard North Sea and Channel threat Tens of thousands of packets of a pesticide Apron Plus DS, containing metalaxyl and carboxim fungi"	"24:D6qkD/qPjD/YrWNaHi1sd+YVUvjPqUFHz16LUsLV6QOo1V1sPf+N:f6yH/P2Ac7+vL55YNk9o1V+Pf+N"	"2db765a141ee195dae8dfbb66ae20225"
"2009-04-01T23:08:58Z"	"http://www.lcm.org.uk/Media/Player.aspx?media_id=27638&;fullpage=True"	"Media Player - London City Mission"	"Media Player - London City Mission UPL Consultation 2: Gospel Preaching Tim Keller Recorded: 24/02/2009 Length: 0 minutes Downloads: 113 "	"3:dBrEcPFkuRRGNArjQXQKWV8XQUC4IUVSV2r8oXUZLFVfLcJ9KEgfbWF:Dr1PdeQs7sUr8KUtjW9fDF"	"187355e03c9b07a6cfe22998945685af"
"2009-06-30T12:49:54Z"	"http://www.badmintonengland.co.uk/fl/clubs/teams.asp?c=6049"	"BADMINTON England - Badminton England"	"BADMINTON England - Badminton England Badminton England Search ? Privacy Policy Copyright & Disclaimer Accessibility Website by Powered by News BADMINTON England Tournaments Team England Play Badminto"	"12:opQKPc7J0q20JLe+gGsnEYtbuaDfeeAIoAbkdYqx8/AE+t2arDl:olqwSq2sxLflAISYg2AE+Bl"	"3485d91b13f8c1d890fd24fcac935560"
"2009-07-04T23:26:29Z"	"http://www.raisingkids.co.uk/todaysnews08/news_021208_02.asp"	"Caesarean birth increases asthma risk - Raisingkids News"	"Caesarean birth increases asthma risk - Raisingkids News Raisingkids is a sister site to UKfamily.co.uk Favourites: Share your story Adviceopedia List Bank Join Raisingkids today and get expert advice"	"48:z1tRoEnX15EeLEtbH9e91wrPU8E4lpVLcjByjNNvBh/EmT4FyJkouBbjTTGvMyTr:7zF5BUdw+vzTLcjBCvBh2yJkoMj9yTb/"	"b1cbbcb734c2c3f23013db8c9f4b8123"
"2009-11-06T03:07:16Z"	"http://www.ancient-tree-hunt.org.uk/recording/addtreecomment.htm?NRMODE=Published&NRORIGINALURL=%2frecording%2faddtreecomment.htm%3ftree%3dskNARlBj7UynkjY3efI7LA&NRNODEGUID=%7bCA8DA8A5-D109-4E9E-8B50-F2A7899E802C%7d&NRCACHEHINT=Guest&tree=vWYRgIlQOUWm2GIDrWm7Bg"	"The Woodland Trust | Recording | Add a comment for this tree"	"The Woodland Trust | Recording | Add a comment for this tree Skip navigation | Search this site [] [] [] Record a tree Clusters of fat old trees Recording more than one tree Tree Blogs Print this page"	"24:3EsyFLgVqPv81nJ2gRxng7qmG3g+WJ3GmlBge+WFR6X32XLwxIVGg7D7:3EsyFsVRFZ47qh3gR3GCye+2igMiVH/7"	"1814f1a7380b6a85918bf8d408a6a121"
"2009-10-09T19:42:02Z"	"http://www.thisismoney.co.uk/email/readlForm.html?in_article_id=456844&in_page_id=1"	"Help! We owe ?52,000 on credit cards and loans | National Debtline advice | This is Money"	"Help! We owe ?52,000 on credit cards and loans | National Debtline advice | This is Money FTSE 100 LATEST 5161.87 +7.23 POUND TODAY 1.0777 1.5839 Power portfolio LATEST ADVICE: The best cash Isa rates"	"192:wqLBSPa0sn2wnGdKhDqh+wFT9slLkUiCrP6o8qV0U6:vdSPq2wn4E2EwFT6JqCrP6ol0U6"	"979c34cfce369f0641c26512b0f47610"
"2009-06-12T03:32:42Z"	"http://www.assemblywales.org/gethome/calendar.htm?&ty=2009&tm=7&td=30"	"National Assembly for Wales | Calendar"	"National Assembly for Wales | Calendar National Assembly for Wales Accessibility | A-Z | My Account [Jump to Contents] Cymraeg Home News About Us Business Members Senedd Get Involved Assembly in your "	"24:3BAtqX/dV25Jb+CnLLkHNos5eREyRLyR0yRZyRRpWREyRLyR0yRZyRCos5CeuvR3:3BAE/dgJbvLQHma75cs3x0ByR"	"d311bd89f28deb6d406ff7f0335659e8"
"2009-03-10T14:14:43Z"	"http://www.publicwhip.org.uk/mp.php?mpn=Keith%20Darvill&display=summary"	"Voting Record ? Keith Darvill MP, Upminster (10154) ? The Public Whip"	"Voting Record ? Keith Darvill MP, Upminster (10154) ? The Public Whip Search: Newsletter (info): Sign Up Login Home News Divisions MPs Lords Policies Forum Join Us Help / FAQ Voting Record ? Keith Dar"	"48:0rjSVubcZSiABgBartKm65kxt/BqO5Cz6kLl2FYCVreHPL+u:P1ZSiDBar/65Z6glYVCvl"	"b1805899ebbdd6af628f1ce66c89a5a7"
"2009-04-06T11:18:53Z"	"http://www.search.revolutionaryplayers.org.uk/engine/custom/place.asp?theme=6&originator=%2Fengine%2Fcustom%2Fplace%2Easp&page=7&records=1717&direction=1&pointer=21&text=0&offset=60"	"Revolutionary Players - Place"	"Revolutionary Players - Place Home : Place : Menu ? Browse : Place ? Select a topic >? Browse Derbyshire (80) Herefordshire (6) River Severn (53) Shropshire (221) Staffordshire (498) Warwickshire (762"	"48:UbXzT4BSiiU8ZBj8ngB3UDB/XUmzFIMtBZiZf+BZP9v9lUP9DBcuBC08QUwVB75K:44QZ58gpmRlRIMty+f9v9l69DVDF1Vpk"	"20d9b574034315e2aa45ddd55e3b3531"
"2009-06-16T17:55:42Z"	"http://www.lancashire.gov.uk/corporate/web/viewdoc.asp?id=39511"	"Cycle Infrastructure Design"	"Cycle Infrastructure DesignLocal Transport Note 2/08 October 2008 Cycle Infrastructure Design Local Transport Note 2/08 Cycle Infrastructure Design Department for Transport Scottish Executive Welsh As"	"3072:Gfm3Aqvv2dAeJ+UM8jaDwg3FFSAy4/jMdaN2WrWWjIl9S6cIe8fpA1Q8c8BVy3nz:Gf5qu7naJWtSWuNF6"	"b7405fc95f51b1930a858207421f038e"
"2009-02-10T02:34:37Z"	"http://www.tullowoil.com/tlw/media/news/2006/2006-03-29/?t=print"	"Tullow Oil plc- Tullow Oil plc 2005 Results"	"Tullow Oil plc- Tullow Oil plc 2005 Results ?Tullow Oil plc 2005 Results 29/03/2006 Record Results in 2005; Positive Outlook for 2006 Tullow Oil plc (Tullow), the independent oil and gas, exploration "	"768:x/lqNDv5gvhd4tyEGufgn69lpJ0hPgwcfKFVB0J66hsytetI8rPx:x/EVy5dAyEGTnIpehPL/FVB0J66OyiIm"	"26dbacbe682f79a4d04718da6ec37965"
"2009-07-26T04:03:47Z"	"http://www.labour.org.uk/women/home?Results_0b9691f2-e9f9-9fa4-892a-09fbce0da103=148"	"Home"	"Home Loading... Please wait... X X ? previous | Page 1 2 3 4 5 6 7 8 9 10 11 12 13 14 15 16 17 18 19 20 21 22 23 24 25 26 27 28 29 30 31 32 33 34 35 36 37 38 39 40 41 42 43 44 45 46 47 48 49 50 51 52 "	"48:YjPe+GMWvTRIbPteL2LLLbQRyXmfX6e5eXj8fafzWOQMG1iTyxJpTKKDsv3NqlRF:kUdMteL2LPbEfXheXj/rvqdrov3cz1"	"a3bdfdf58d9a3be2dd8ceb1d0ec657cf"
"2009-04-09T00:32:30Z"	"http://www.dimsum.co.uk/index2.php?option=com_content&task=emailform&id=569&itemid=17"	"Dimsum - New Year New World"	"Dimsum - New Year New World E-mail this to a friend. ? Your friend's E-mail: Your Name: Your E-mail: Message subject: ? ? "	"3:KQIWGxpJBFaEIFRNO6NL90QVNICNSJfFbGdAt0VN5IfFdWfsQH:LIWGxBFPIZbL90G9SJlGdu0VN5ILVq"	"6480ea43afd3d686375e579547d2e66e"
"2009-06-21T01:33:25Z"	"http://www.ukip.org/content/video-zone/919-telling-the-truth-about-the-european-elite"	"Telling the truth about the European elite - UK Independence Party"	"Telling the truth about the European elite - UK Independence Party ? Home MEPs Regions Young Independence Join or Donate! Events The UKIP Shop Campaign Policies ? Search the site Join our mailing list"	"24:eKFJx7yiSwUSEFLsvgM+B/+Ulyusz15O86i1zhxQBp:hyiBUSuugAUluzci1zDQP"	"c0519b9f7ea93f6e44766e6907da7ea9"
"2009-01-28T12:10:08Z"	"https://www.bankofengland.co.uk/statistics/cwc/2004/jun/cwcpr.pdf"	"Microsoft Word - BOEstyle_template.doc"	"Microsoft Word - BOEstyle_template.docPress Office Bank of England Threadneedle Street London EC2R 8AH Statistical Release Telephone 020-7601 4411 E-mail: press@bankofengland.co.uk NOT FOR PUBLICATION"	"768:Su0iAaFxRYiAz8fNVwSlvGxxH5mfJDZwFErRut1nMd0+9hRbNv7k:F0WTRYP8VVwmuxxQfiyRuC0+9hRbB7k"	"e54f35e963bfdf9e5904d474e1af1a23"
"2009-02-06T02:31:08Z"	"http://www.thekitesociety.org.uk/PDF/Goose.PDF"	"Goose"	"GooseIssue 15?April 1983?Dirigible Go(o)se? Harm van Veen Dotted lines are fold lines. Each keel has a bri- dle as shown on right and the kite is flown as a two liner. "	"3:kWJNITubAXEBRFhKR2vW+WKJBWxwel5EmMJgEWr48DgvgyFMsJCCEF0KzF:fNbAUBRFhlvW+NJBWqelpMJBWc8D4gyk"	"b577bf2b48233937315e733b5af5fffb"
"2009-03-09T01:45:13Z"	"http://www.youwriteon.com/myaccount/login.aspx?referrer=%2fbooks%2freviewchapters.aspx%3fbookguid%3df513a325-1944-4189-b022-d3272fb42ef3&print=Y"	""	" Member Login Please Login New to YouWriteOn ? Already a YouWriteOn user ? Membership of YouWriteOn.com is free, funded by Arts Council, England. If you would like to register as a Writer or Reader, c"	"12:9eneLjfdFSWgXKh8Xz94Q0WRAifGqGsumM8V/JsVPKsgEtZsHJETtMvyjpEyN4LM:MMjfdFS3Q8X5GqG47V/JqlggZsHGBUyL"	"4b16df36527268e5aaf91bc13c10e99d"
"2009-12-30T16:44:52Z"	"http://www.preciousseed.org/view.php?id=1428&columns=2"	"Precious Seed"	"Precious Seed Main Home Shop Invoices Daily Thought Index of Articles Search Articles Past Magazine PDFs Book Reviews Support Precious Seed Links Contact Login Issue 1985, Volume 36 Issue 5 Jottings f"	"24:sUMzvDEzIHGwfdZkiZKcEXleG48MDGTlfWZSwMETMpN1eeUVcp3D/1Qp/9Z:uzrESdZ1ZlfAl8NMV1etVcp3ep//"	"368ba01c340a65683c9add42a665cd42"
"2009-12-17T04:07:13Z"	"http://www.engagingplaces.org.uk/search+results?f1=National+Curriculum&t1=2P%3f%2e5%2e3%2e2%2e3&f2=National+Curriculum&t2=2P%3f%2e3%2e3%2e2%2e4&d=List&n=20&s=alphabetical&sd=ascending"	"Search results | Engaging Places"	"Search results | Engaging Places Search results Home News Teaching & Learning Visits Resources Network About Us 17 December 2009 Home / Search?results Search results Your search found 1 item Sort by: "	"48:d5hjZKY4TYIxuAdKtAmxNyZ0SXkTkJbrGErGfp+2HerHfvt37:dBr8mi0tQ5CECfoTDtL"	"778418a339a97bda715877afaab4180a"
"2009-03-31T22:04:47Z"	"http://www.nice.org.uk/nicemedia/pdf/ip/IPG171guidance.pdf"	"IPG171 Laparoscopic helium plasma coagulation of endometriosis - guidance"	"IPG171 Laparoscopic helium plasma coagulation of endometriosis - guidanceIssue date: May 2006 NHS National Institute for Health and Clinical Excellence Laparoscopic helium plasma coagulation for the t"	"192:vV8L5k1+eskWRKyDxt6pzF+VE/4HxijLA:vV8L5k1YkWRfDxtCzF+VE/4HxoU"	"74dc2940d205670db2045589c54a3511"
"2009-06-30T10:33:02Z"	"http://www.lamp.ac.uk/regulations/students/index.html"	"University of Wales Lampeter - Error 404: Page not found"	"University of Wales Lampeter - Error 404: Page not found Home Applicants Courses Current students News & events About the university Open days A-Z Error 404: Page not found Sorry the page you requeste"	"24:I1Jgj16EvmHLFzV/WFo5jFMQIqwvsbfJv:P2LzWOIl/q9"	"986435673f75feb8f33d988339a03f87"
"2009-11-20T13:10:29Z"	"http://www.assemblywales.org/gethome/calendar-details?id=971643611&ty=2009&tm=12&td=3"	"NAfW Calendar Detail"	"NAfW Calendar Detail National Assembly for Wales Accessibility | A-Z | Site map Help | My Account [Jump to Contents] Cymraeg Home News About Us Business Members Senedd Get Involved Have Your Say Assem"	"24:tAhzqXv6KV25ta+CSLkHNos5eREyR0yRZyRCyRkpWREyR0yRZyRCyRnos5bjBCyP:tAQv6KgtaKQHmwcffalyR"	"57b0f94eca907460a39394f8ad2891a4"
"2009-06-16T18:05:14Z"	"http://www3.lancashire.gov.uk/corporate/news/press_releases/2004/07/15/0003.asp"	"News: Lancashire Local Launches In South Ribble"	"News: Lancashire Local Launches In South Ribble Text | Home | Your Council | Business | Residents | Visitors | Search ?|?A?to?Z? News Lancashire Local Launches In South Ribble Back Recent Releases 200"	"48:vjElX7E7s/5TbW6cPlGl7W6GXs6Pb4lmDOoLbtZRd8fwDmu6d9lKPSCFw3yAJYoB:WvTbQtGlwB4EOoLxK4J6dkbUyRojmE"	"361f9b580507b8de9ec1fd73a7cc63c7"
"2009-07-07T13:43:52Z"	"http://www.disabilityalliance.org/edm566.htm"	"EDM 566: Free prescriptions for long-term conditions"	"EDM 566: Free prescriptions for long-term conditions access key options skip navigation what's new home site map search disability benefits consortium home page about us | benefits | contact us | freq"	"24:cPontOT8C0bbfVE06PonjvkZrnwX5oOUZI/9fuJnRF/lLntfx/Dk8OncFQtLBoRm:Hyl0bbfVEGjv6cjh/9eRbTQcStLBoR1g"	"bdbb0c3347f7c5eb7d4adabaa7adb291"
"2009-01-06T10:19:13Z"	"http://www.sabmiller.com/index.asp?PageID=6&referrer=472"	"SABMiller - Brands"	"SABMiller - Brands Jump to main content (accesskey s) Jump to site navigation Jump to search Jump to site index (accesskey 3) Jump to accessibility statement (accesskey 0) Your page Videos Contacts Se"	"48:rWq+DxbHsAuIMON4zgVHC9jK6oPGrc8JfpM5OXwLqAi0Ydj:rmxDsAuqlVHCRK6lHYLzPYdj"	"603d58b385d9f7fa088a42b26ed41eb7"
"2009-11-20T06:38:04Z"	"http://www.nuleaf.org.uk/nuleaf/home.asp?r=37775&NavInUse170=1&LastSelectedItem=32"	""	" Admin Login &nbsp; About NuLeAFE-bulletinsBriefing PapersCase StudiesPolicy StatementsConsultation ResponsesSteering Group PapersEvents and MeetingsReports to the LGAPress Releases and ArticlesResear"	"48:9w+9fboAYCDnNLyr9d/O2V0GFM9pa4fWBlKi0biHRiYE6uVXa:i+NoAYCDN+r9d/Fy84fWBlKi0z6uU"	"e186199671f542611a56bd3e064aa966"
"2009-06-22T18:11:50Z"	"http://www.thepigsite.com/swinenews/14880/pork-futures-hogs-uneven"	"Pork Futures: Hogs Uneven"	"Pork Futures: Hogs Uneven ?Other 5M Publishing sites ? AboutVideos DownloadsEvents RecipesPhotosJobsConsultantsEmail to FriendSEARCH decrease font size increase font size change type face bookmark thi"	"96:6soeHA+JMrDFAWkpEMT/ghqnxjj5W4I1YYUlsgBKObqLjJqWVl4ZfVJwF:6soegEMrDFAWOEMTHxPG2l6RrUPm"	"2629c4360ffb514c54c7a0113fbb7d61"
"2009-12-02T02:29:28Z"	"http://www.encompassculture.com/news/britishbookindustryawards/1.4"	"British Book Industry Awards - enCompass Culture"	"British Book Industry Awards - enCompass Culture ? Start About enCompass Reader in Residence Reading groups Discuss Chat Booklists Author index Help Click one of the above options to start searching.."	"24:IAY3TP52XlbSxKMsjsuNTUy3eS4gM7z3pzZAuwA4VljPm1fqQGdao7me9BH5n:uwlbAsGWeS89ZTTKmVqQEBH"	"d4e563efe15622a11d02ae04de671a02"
"2009-03-07T19:49:56Z"	"http://www.1066.net/photos/carnival08/080809/pages/080809-324_JPG.htm"	"Hastings Old Town Carnival Week 2008 - Carnival Day / 080809-324.JPG"	"Hastings Old Town Carnival Week 2008 - Carnival Day / 080809-324.JPG Hastings Old Town Carnival Week 2008 - Carnival Day 080809-324 Previous | Home | Next "	"3:xRKazlmEHyl0ULM8hPK5WBozlmEHyl0ULM8hPHvWBPXGtTXF:XjzSlvNtYzSlvNHcPX6h"	"d957a182b07fcaede10b76d440d6631a"
"2009-11-02T18:02:16Z"	"http://www.englandspastforeveryone.org.uk/Counties/Herefordshire/Projects/LedburyPre1558/Items/Ledbury_Wills_and_Inventories_1660___1679/assetdetails/5213?Session/@id=D_EM0U7bKYy9T6rIuexLjq"	"England's Past for Everyone in Herefordshire :"	"England's Past for Everyone in Herefordshire : Herefordshire Search ? Advanced Explore Search Explore by : About Herefordshire EPE Publications Explore Herefordshire's Past Schools Get Involved News a"	"48:tweQ3OZH3lnC/OpSmsSr//LK7EdSTblO4L954KMTPDzd9bbFn:tzDXI/CsSrklJnfM/F"	"4c0d9cb3d91fc326ce5a9d01f2c1b638"
"2009-07-17T15:10:37Z"	"http://www.assemblywales.org/bus-home/bus-committees/bus-committees-second/bus-committees-second-sjr-home/bus-committees-second-sjr-agendas/n0000000000000000000000000032348.pdf?langoption=3&ttl=SJR%2009-05%20%28p-9%29%20SJR%20Committees%20Annual%20Report%20-%20Annex"	"Social Justice and Regeneration Committee"	"Social Justice and Regeneration CommitteeSocial Justice and Regeneration Committee SJR-09-05 (p.9) Annex Report to Assembly 2004/05 1. Introduction 1.1 Standing Order 9.9 requires subject committees t"	"384:4X1SeJXz0+GHUPWbXlKUdvXig6m4ZY6lpU3/it20XFR:2fJj0cwlWmGppgK9r"	"a50babfa9a2c8f046e2124a978daea55"
"2009-04-15T17:20:09Z"	"http://www.londonarchitecturediary.com/planner.php?m=2009-02&d=2009-08-29"	"Untitled page"	"London Architecture Diary ?Sat 29th Aug 09? Search:? Type:? All Talks Cycle Rides Tours Walks Events Degree Shows Debates Conferences Exhibitions Film Seminars Installations Others Partner:? All -----"	"1536:sXTGRbMB/rNKyzUJBW5udJiYGs1BzfY3zTCIabPx+9:MZtv1aRbM"	"29da11f0182b4eb435d2a103a204cddc"
"2009-11-21T13:22:40Z"	"http://www.puffin.co.uk/nf/Sbscr/AlertForm/1,,9781846469961_1000000086,00.html"	""	" "	"3:F:F"	"29a4d2678e2b3684d7fa2022da296d8c"
"2009-09-25T11:16:33Z"	"http://www.geograph.org.uk/photo/55495"	"Conduit:: OS grid SJ9463 :: Geograph British Isles - photograph every grid square!"	"Conduit:: OS grid SJ9463 :: Geograph British Isles - photograph every grid square! Geograph - photograph every grid square SJ9463 : Conduit near to Rushton Spencer, Staffordshire, Great Britain Condui"	"24:vZ5WfPWvPUv4e6VtRMf6DPssS+E7VfuMwMjXxYKMvH1rdIUJQItN:v/WfPWs4eg+ZJ+E7V+2qKMVrdIUJQID"	"9293cc9bbc2825e8dbb2587f2798f3b7"
"2009-04-15T00:35:24Z"	"http://www.adamsmith.org/blog/misc/blog-review-577-200804241281/"	"Blog Review 577"	"Blog Review 577 Skip to content Skip to main navigation Skip to 1st column Skip to 2nd column Adam Smith Institute Home Blog Events Issues Publications Statue Students Media Shop Join Us Blog Review 5"	"48:6RpBCjhsgT1eH62e8712+8XoTUY2Fq876uSooH4H/pN:6Rp4VT7vadwoTX20876uSooH0/pN"	"532c9d8220d8ea2f2c4aac9f049d0a6f"
"2009-02-11T05:23:29Z"	"http://www.foxtons.co.uk/search?property_id=675387&resource=schools&search_form=map&search_type=LL&submit_type=search"	"Schools near Rayners Lane, Pinner, Middlesex, Pinner, HA5. House to rent (Property to rent) through Foxtons Estate Agents"	"Schools near Rayners Lane, Pinner, Middlesex, Pinner, HA5. House to rent (Property to rent) through Foxtons Estate Agents 0800 369 8667 Buy Sell Rent Landlords Investments About us Contact My Foxtons "	"96:ZuxvDxU0hU5OqSx5+rFwYWv3yNbhd4vGY8nyWtGQ/yGq05J5lghljEHW:ZuxbxUaYSxcpwYW/QAJ8GdVuKXjEHW"	"dbe2742a4e0289b737a3f1b1cf314309"
"2009-07-27T01:51:48Z"	"http://www.brc.org.uk/details04.asp?id=1030&kCat=&kData=1"	"British Retail Consortium - News ? ? ? ? ? ? ? ? ? ? ? ? ?"	"British Retail Consortium - News ? ? ? ? ? ? ? ? ? ? ? ? ? The BRC - Home News News & Press Zone Retail Myths Policy Work Policies & Issues Consultations Meetings Special Interest Groups Business Info"	"96:hT+hqOlG9u9wLiQIogoNk0kCj3fsvOtnzt:hT4vlG9uaLiQIWrki0G9z"	"381a9a3d0741759bc178fa891602e7b1"
"2009-03-20T08:40:23Z"	"http://www.easington.gov.uk/images/Eas%20LDF%20Appendix%201_tcm4-16819.pdf"	"CORE STRATEGY AND DEVELOPMENT MANAGEMENT"	"CORE STRATEGY AND DEVELOPMENT MANAGEMENT CORE STRATEGY AND DEVELOPMENT MANAGEMENT Preferred Options Report Easington Local Development Framework th 8 April 2008 Foreword 2CORE STRATEGY AND DEVELOPMENT"	"3072:leo7f0cIpdsvKwn8Cn/EIRNYuCRjttAlK9tX2AiONj5MDcG:6Cn0HjtdL2"	"a5d6278f4838f9167d07ffe3f75b8c7b"
"2009-11-18T14:27:22Z"	"http://www.welshmodels.co.uk/index.php?queryParams=qs%3D06oENya4ZG1YS6vOLJwpLiFdjG91IC1XkESmNz84tgmylYC-mRrOHibri5GTlktW7nFgjU1vEioPkFDC5r0OXuIiQcdVf8KLtD7mjo-BtMDN8CfSv7BiQf1dlGQko6oKb2WsSP1e4kpPzd-SbBnkBXjKJggR4VQBMMgo8i9jPG137e36-6uuigbp0MJy0EDEG6kNT7G4YuVHcoFdbOxqYSts7jSJSQ9zBVyEIv_AgpGZxJ1w9_l3PJCPQZUHXFKKOA-dfPWd9uDLQfMw..%2CYT0yO0w9S2l0Y2hlbjtSPTM2O1M9Z2VuZXJpYw.."	"Namesco. A World Apart"	"Namesco. A World Apart Namesco A World Apart Is this your domain? Login here to create a page: Login Keywords Next Page > Moben Kitchens Request a free Brochure today. UK's Leading Kitchen Specialist."	"48:KcYeM4vQuY46jxWVWOVXjDi6HxiYgFUU4sjFtnEOS5iRdXBw:KcYmvH6jxWLDiYslFUUdFNEOzXBw"	"baf44f99d2b374200c71bcb7ebda0b25"
"2009-07-31T18:33:01Z"	"http://www.socialistworker.co.uk/art.php?id=11058"	"Invasion did not bring peace to Somalia|31Mar07|Socialist Worker"	"Invasion did not bring peace to Somalia|31Mar07|Socialist Worker Skip to content latest edition back issues > 2009 2008 2007 2006 2005 2004 2003 2002 2001 2000 1999 online reports subscribe > ?4.50 di"	"96:2sUEB0mCykxch/iXiYHqlYlWXPmTgc1punfgUKlRXJcwRc4rvynZC5SOd:2DUCbcViXiYKlYgXoun0tlvynZvC"	"f29408c35f3513e0920f842f80acdaba"
