"2009-05-09T20:48:26Z"	"http://www.paralympics.org.uk/news.asp?itemid=1596&section=000100010006&sectionTitle=News&showdate=2008-8-1"	"News - The British Paralympic Association"	"News - The British Paralympic Association Fast find ... Jobs Library Parasport Features Jump to Seach Print View Newsletter Contact us Donate About the BPA Beijing Games 2008 ParalympicsGB Team Beijin"	"24:jqFontCm3lkPWI31XLgQ2Pbd56a+jFjklJ8v6L:jqK3lQvFXLoPbd5OjFjeBL"	"b13bb58f7f0b72644e14694022521dc2"
"2009-03-13T08:59:41Z"	"http://new.wales.gov.uk/topics/planning/devcontrolquarterlysurvey/q42005/?lang=en"	"Welsh Assembly Government|Development Control Quarterly Survey (October to December 2005)"	"Welsh Assembly Government | Development Control Quarterly Survey (October to December 2005) Skip to content Development Control Quarterly Survey (October to December 2005) Contact Us | Login | A to Z "	"24:f9GZzP6OZCcJ1j8UvAo49CEFZ2Bfbmz5sj1G5AMeVo:apUc3jV34CqzGA5AMOo"	"efc125bd2050e5c5f19dc20115bbd7b7"
"2009-10-02T05:57:17Z"	"http://www.geograph.org.uk/photo/12444"	"Monument near Ythsie:: OS grid NJ8831 :: Geograph British Isles - photograph every grid square!"	"Monument near Ythsie:: OS grid NJ8831 :: Geograph British Isles - photograph every grid square! Geograph - photograph every grid square NJ8831 : Monument near Ythsie near to Ythsie, Aberdeenshire, Gre"	"24:iFqWfPWGYPVfuRpzecwqe7Dfdx4Y5WGxYKMvH1rdIUJQbctN:iFqWfPWG+feph07DXUGqKMVrdIUJQID"	"f5a3d9f73c01c476828d334b79ec59ca"
"2009-12-08T20:10:30Z"	"http://www.parkinsons.org.uk/pdsforum/default.aspx?return=%2fpdsforum%2fmessage.aspx%3fforum%3dabout-the-forum%26topic%3dshould-the-word-disease-be-used-in-connection-wit%26post%3dtootsie-your-last-post-made-me-chuckle-ill-second%26user%3dHighfield"	"Parkinson's Disease Society"	"Parkinson's Disease Society Skip to main content Helpline: 0808 800 0303 Contact us Accessibility options ? Home About Parkinson's Local to you Advice Support us Research About us For professionals Ho"	"48:vojhRF/YVfua3YxaVxhxb6sxFi/5s6kUeUIQuID8DGdEziQD96Emf:gjx/YNT3Y8jIq3XGdEziae"	"3cc8bd00f2607aeee5c3d94fff917682"
"2009-03-10T15:06:21Z"	"http://www.anglican-mainstream.net/?p=7161"	"Anglican Mainstream ? Blog Archive ? Is the liberal tide in the Church of England beginning to ebb?"	"Anglican Mainstream ? Blog Archive ? Is the liberal tide in the Church of England beginning to ebb? Anglican Mainstream Suggestion box Join our Mailing List Editorial Policy Who We Are Anglican Mainst"	"384:76G9YINyQq/4npHwpVT/S6AbAx3IXRaAbbqw21hrbIweyHjmk:7A4Qgnpa9/S6Abd8X1h/I1k"	"69cc7ef7191662566f09ce288f0dbd18"
"2009-02-02T12:34:12Z"	"http://www.economicsuk.com/discussion/viewtopic.php?p=1566"	"economicsuk.com :: View topic - Housing market bears are in retreat"	"economicsuk.com :: View topic - Housing market bears are in retreat economicsuk.com EconomicsUK - live economics discussion. ? ?FAQ? ?Search? ?Memberlist? ?Usergroups? ?Register? ?Profile? ?Log in to "	"192:11rMHSWPMwazU0x5jLAw815am3cm3YeYHFzQ0FzQZsTXLCVxDgX:HrMyWPMxzd5j8w815OZfpOVxA"	"918ed6a3c5fa07e2315f86db50e94043"
"2009-12-04T05:40:01Z"	"http://timworstall.typepad.com/timworstall/2007/06/blog_awards.html"	"Tabloid Edition: Blog Awards"	"Tabloid Edition: Blog Awards ? Tabloid Edition For Tim Worstall, The Broadsheet, go here: www.timworstall.com About Me Disclosure Policy Fast cash loans are quick and easy to apply for.Get payday loan"	"96:vw0JHu1G0dVGSJ37gJRCiNnZ6f/2aCub2axlvK+IOEqQQI3bsZAaU:vw0KbR3YRCI0H2yb2Iy+jEtR"	"cadae89e4a19aad0247a06d7e5ac697f"
"2009-06-08T21:17:22Z"	"http://www.golakes.co.uk/planmyvisit/thedms_makebrochure.aspx?dms=65&itinerary=8&showItinerary=1&eId=5062640&eIdNo=2"	""	" Logon | Register Your browser does not support inline frames or is currently configured not to display inline frames. Plan my visit Home Be inspired Plan my visit Where to stay Things to do Places to"	"96:Jrk6uonlRHq4pS2hLJBVKDAG/t4KHGyrzABfnB3WkDZ/pV:JrkMnPqslKDAG/uKHlqVB"	"bb61edcdde3505491b0d6c48e158cacd"
"2009-02-12T15:01:55Z"	"http://www.xcri.org/aggregator/courses/19290-BA-Hons-Film-and-Television-Studies-Creative-Writing"	"BA(Hons) Film and Television Studies/Creative Writing"	"BA(Hons) Film and Television Studies/Creative Writing Log in with OpenID: ? OpenID is a decentralized single sign on and identity technology. Get a free OpenID now, or read more about OpenID. Find cou"	"48:7yhsttHk/YPK19ffc0Irt4qKJjGI2D+dfnnzSEf3:dfKi4+I2DQ7Ff3"	"2c17adf4d08911feee9f0fb43a655fe4"
"2009-07-07T12:05:12Z"	"http://www.flickr.com/photos/mousavi1388/3600695740/sizes/o/in/set-72157619327204758/"	"Flickr Photo Download: Mir Hossein Mousavi in Tabriz"	"Flickr Photo Download: Mir Hossein Mousavi in Tabriz Back to the Flickr photo page Uploaded on June 6, 2009 by mousavi1388 Available sizes: Square (75 x 75) Thumbnail (100 x 69) Small (240 x 165) Medi"	"6:2xp/CLO0JO8KZHKKLVQIcSC9t4YLE7vkN26yF2RAzgtKZHKB:0/IhM8YlcSsiYQ7vFOb"	"b71b5e929329600b4efc14d7cc4bb065"
"2009-02-25T00:14:20Z"	"http://www.ica.org.uk/Hot%20Fuzztival%20DoubleBill%3A%20Hot%20Fuzz%20%26amp%3B%20The%20Super%20Cops+12970.twl"	"Institute of Contemporary Arts : Film : Hot Fuzztival Double-Bill: Hot Fuzz & The Super Cops"	"Institute of Contemporary Arts : Film : Hot Fuzztival Double-Bill: Hot Fuzz & The Super Cops Skip Navigation Hello, welcome to the ICA Home?What's On?Events?Film?Hot Fuzztival Double-Bill: Hot Fuzz & "	"96:Lz6l6pHbi4QlPkcd0q3oAkglURnrO31HhLoticTwfPgB8cEokOX8CiT9VUKqxD:4ac1lURrwxVfcTmPkZpM7HUKqxD"	"aa8ba44d97581fe959f05a538b978fdd"
"2009-02-20T07:54:10Z"	"http://www.cynulliadcymru.org/abthome/abt-foi/disclosure-log-month-view/request_8.pdf?langoption=3&ttl=Enwau%20unigolion%20sydd%20wedi%20ciciawa%20gyda%27r%20Llywydd%20%28Saesneg%20yn%20Unig%29%20%28PDF%2C%20761KB%29"	""	" "	"3:F:F"	"49e336c631567daa28761b243701e73f"
"2009-08-17T21:10:06Z"	"http://www.knowhere.co.uk/town/user_board/messages/533"	"old freinds (Netherton)"	"old freinds (Netherton) old freinds (Netherton) members login here looking 4 marie wilson, she used sell the big issue outside laceys anyone help? What are you waiting for? Register here NOW! For gene"	"24:zsgSvnumhXOQAzeuuWGFwn0TmIYKZkV09XmsAzebZpbOFyI23Xq8L1ghnAxm:IzmQrAhh0TcI80FTAGZpbnWhn8m"	"3b68d32c020a5bf67f28a92c8affe540"
"2009-02-21T02:35:28Z"	"http://timesonline.typepad.com/alphamummy/2007/06/is_your_kid_a_g.html?no_prefetch=1"	"Alpha Mummy - Times Online - WBLG: Is your kid a gigantic fat heffalump?"	" Alpha Mummy - Times Online - WBLG: Is your kid a gigantic fat heffalump? Where am I? HOME COMMENT Blogs Alphamummy Alpha Mummy - Times Online - WBLG Alpha Mummy is the blog for mums who work, used to"	"192:Cg49e3HHze9hXWH/mGfzgFummLDhIePj+Ac6An9JzrzlLkn+/M2SO2syGyGU7D2H:w4Qs/FMEZ3CAchn1Lu+cGyvaH"	"90efa24b7387f0d17fa0edcca67d9141"
"2009-05-04T08:09:17Z"	"http://www.jiscinfonet.ac.uk/Resources/evalkit/toolkit-database/all-records/Library/ev028"	"JISC infoNet - Multimedia Development Tools"	"JISC infoNet - Multimedia Development Tools Skip to content contact us | home | accessibility good practice and innovation about us infoKits Tools & Techniques Publications Events Blog You are here: H"	"96:8xM6mkBmGdiaY6Q1fE8lLGamqHq/T6j6ieFMS6t74p55Q:gXBm6CftEamMsT6j633kWQ"	"ef9f8491ae44f450ed42dd47bbd52f60"
"2009-02-05T18:08:16Z"	"http://desertionsurvivors.org/pbb/viewtopic.php?f=8&t=1818&start=2&st=0&sk=t&sd=a"	"Desertion Survivors ? View topic - Taken a wrong turn?"	"Desertion Survivors ? View topic - Taken a wrong turn? Skip to content Board index ? Desertion Survivors ? Open Forum Change font size Print view FAQ Taken a wrong turn? This is the place for both men"	"48:UoM3Yms3N6KvDXjCfrNHWhOOmO3G5QsoRm3NqynpeM9f6dtyNYQsjWN2GuzfQE:kY3N6KvTWU9mRoo3NqynMMOENYQNuz4E"	"4f04fd648f06bca372863fd2d69142a0"
"2009-07-09T14:06:38Z"	"http://www.visitcornwall.com/site/places-to-stay/cheviot-holiday-apartments-p101783"	"Cheviot Holiday Apartments - Cornwall Holiday - Accommodation in Cornwall - Visit Cornwall"	"Cheviot Holiday Apartments - Cornwall Holiday - Accommodation in Cornwall - Visit Cornwall Home Page Skip Navigation Home Conferences Weddings Gardens Cornwall Tourism Awards Places to Stay Special Of"	"192:RyjAnt2XU8tOkXDmEeTYGspgPdsuXUp0MYoiM+QW:R/ntOU8tOkXiEeMGspgPdsuXUp0MFY"	"93171106e9de109ccf172a8ab33df956"
"2009-10-09T20:31:31Z"	"http://www.lga.gov.uk/lga/aio/1716507"	""	"Our Past YOUR FUTURE LOCAL GOVERNMENT ARCHIVESContents Introduction ...................................................................................................................................."	"384:HKOy6bA4gD5LZfy+uiCN0r5y7fNh7sFiGxvNLPLSUKo2JqsYKyC/XxrXS+:HKjzLZtazjNysEmNXS+"	"51d98679ca55325f2f1d5bbf1a1a1767"
"2009-06-05T00:10:11Z"	"http://www.soas.ac.uk/business/interface/casestudies/standardlife/"	"SOAS Interface: Case Studies: Standard Life"	"SOAS Interface: Case Studies: Standard Life [skip to content] The School of Oriental and African Studies - University of London Find courses Find people Search Advanced Search A-Z Index About SOAS Adm"	"48:NHwETF3JjBi86lbulVqB5RDow3RtW1BB7mviOWNi2nm6H7:NHjjBL6hpB5R8wkTxk2nm6b"	"2bd9fec273ddfdf923370f018937d82b"
"2009-09-21T16:30:22Z"	"http://www.geograph.org.uk/profile/36887"	"Profile for Clive Elsbury :: Geograph British Isles - photograph every grid square!"	"Profile for Clive Elsbury :: Geograph British Isles - photograph every grid square! Geograph - photograph every grid square Profile for Clive Elsbury Name: Clive Elsbury Member since: April 2009 My St"	"24:75WfPWiZmo9bPiw92KK1WcyUDvxYKMvH1rdIUJQbtN:FWfPWEbPibcUDvqKMVrdIUJQbD"	"0b635a2a7daabd6263fa054a9b4011d5"
"2009-03-27T08:45:24Z"	"http://www.assemblywales.org/bus-home/bus-chamber/bus-chamber-third-assembly-rop.htm?act=dis&id=108986&ds=1/2009"	"Answer to Questions not reached in Plenary (PDF, 14-9kb)"	"Answer to Questions not reached in Plenary (PDF, 14-9kb) National Assembly for Wales Accessibility | A-Z | My details [Jump to Contents] Cymraeg Home News About us Business Business Notice Chamber Rec"	"24:oRAC/qXWt2HQfFJPtNCSVA8t822YNmHXh/b9V1zLnqoKDF:oRAJiGQfF1TFV3hi/dyR"	"c3de6f1b385e0a2b4561d61d0b4b54a4"
"2009-07-06T16:22:43Z"	"http://julienfrisch.blogspot.com/2008/08/tracking-ep-elections-2009-ix.html?showComment=1221774840000"	"Julien Frisch: Tracking: EP elections 2009 (IX)"	"Julien Frisch: Tracking: EP elections 2009 (IX) skip to main | skip to sidebar Julien Frisch Watching Europe Monday, 18 August 2008 Tracking: EP elections 2009 (IX) The two Hungarian conservative part"	"192:SqZQ7JM1KP6XtXK22/b97DumfyTIS4cZfRN/UrmqpUna4AyVbkI88Y2Z4wS5N:SqC7aOEh2/pGmf0IS9ZfHAmqp8a4AW16"	"3b9079b0dd273965105adfb79ffb01a8"
"2009-10-18T07:24:03Z"	"http://www.londonstockexchange.com/exchange/prices-and-news/news/market-news/market-news-detail.html?announcementId=10047494"	""	"FRN Variable Rate Fix - London Stock Exchange Regulatory Story Go to market news section ? Company First Flexible No.5 PLC TIDM AS23 Headline FRN Variable Rate Fix Released 16:15 01-Jun-2009 Number 10"	"24:ElwKVLK0NRa94539Fw/rZapX1KOUaA37vmd26UF:U5uuRas9j51KOUan27F"	"ec2fd5ddeb3820bbc7e81091b3a611eb"
"2009-05-22T00:08:26Z"	"http://www.sartma.com/art_4613_11_96_1.html"	"Counterpart to Head of Health and Social Services Appointed - Saint Helena News"	"Counterpart to Head of Health and Social Services Appointed - Saint Helena News The news that matters from the British Territories in the South Atlantic Ocean. ?Main Menu ?HOME ?CONTACT US ?MAILING LI"	"96:In4+NqAWK7A47TsC99wF2S9EkLAMRRKvO2pfEhJuMch8k:InhNQKcaTsC99wF2SykcMRRUO2pfIJuF"	"3206fa85b48cbd47a7f8478ea11e378a"
"2009-11-22T18:18:42Z"	"http://www.ukbms.org/site2619/1996.htm"	"UKBMS - Yearly counts"	"UKBMS - Yearly counts Home ? Sites ? Arienas Wood ? 1996 ? Arienas Wood: Counts for the year 1996 ? APR MAY JUN JUL AUG SEP Week no. ?1? ?2? ?3? ?4? ?5? ?6? ?7? ?8? ?9? 10 11 12 13 14 15 16 17 18 19 2"	"24:iMbamtVhmED+o24JQSf50hbCKyXewZ3q8b2+7L:zaAV4gK4JQSR0byXewK+3"	"916dee18e0bbd407435aaddf8fb7d501"
"2009-01-08T03:51:49Z"	"http://www.brc.ac.uk/DBIF/invertebratesresults.aspx?insectid=853"	"BRC - Database of Insects and their Food Plants"	"BRC - Database of Insects and their Food Plants BRC HOME ? Database of Insects and their Food Plants Database of Insects and their Food Plants Home | Background | Invertebrate families | Search for In"	"12:xQWv5jnzuQWv5jDQWv5j6z1ThqhQQWv5joylvEe1Pb+Z+Rq3ATF:TBnyBpBE68BZlvEMPbnJ"	"a2bf57724107084e7543210520aef52e"
"2009-03-16T05:53:30Z"	"https://www.sillyjokes.co.uk/pnp.php?Codes=700-411"	"SillyJokes.co.uk's Fair Postage and Packaging Policy"	"SillyJokes.co.uk's Fair Postage and Packaging Policy Our Fair Postage and Packaging Policy Adding this item to your shopping basket would not change your P&P cost of ?0.00. Based on delivery country o"	"24:W7/Y1DzCS/IMqL5i7cTAu9iiTRoEo+me2R32J1qGK9ojOLXV7eJyr8P7tCS2:WjShAC8AuwUDme8GWojUteRw"	"642739a919427ca6a8acbbf60adff155"
"2009-01-23T09:30:50Z"	"http://www.glasgowcu.com/content.asp?section=63"	"Glasgow Credit Union"	"Glasgow Credit Union 23 January 2009 Register for your PIN Can't Login? Trouble browsing our site? Privacy Policy Terms & Conditions Website Security Close This Menu Enter no more than 4 keywords ? Vi"	"96:gYshHLYHlxabqqBnR+iftW9Gh+xe3GM+JEpjj5ENe:gYs9LYHlxauqJUif89SP3t6EH"	"303493da331c72bd116c3f9085f7d380"
"2009-11-30T17:58:51Z"	"http://www.usdaw.org.uk/arena_journal/14/brown_budget.html"	"Union of Shop, Distributive and Allied Workers: arena_journal: 2005 Issue 2: Budget bonus from Brown"	"Union of Shop, Distributive and Allied Workers: arena_journal: 2005 Issue 2: Budget bonus from Brown Join?|?Update Your Details?|?Contact?|?Feedback?|?Site Map ? ? About e-mail updates Newsroom Campai"	"48:+Ad/M7hREm0ihNQ2ad3fby6tkPpORg11FcinYDjB:+AyTRhNgJf/R+AinYDjB"	"df830fdb70aa618c7a2885775a349e44"
"2009-10-17T16:04:56Z"	"http://www.geograph.org.uk/photo/925658"	"Farm buildings on the dismantled railway:: OS grid NY6522 :: Geograph British Isles - photograph every grid square!"	"Farm buildings on the dismantled railway:: OS grid NY6522 :: Geograph British Isles - photograph every grid square! Geograph - photograph every grid square NY6522 : Farm buildings on the dismantled ra"	"24:D2mZWfPWnXcFOmNfa5QVYLOBIRBxnxYKMvH1rdIUJQwtN:amZWfPWnHScQYhnqKMVrdIUJQwD"	"ab3d400abadc6ba0060b30de9d914deb"
"2009-06-16T23:09:50Z"	"http://www3.lancashire.gov.uk/corporate/atoz/a_to_z/searchService.asp?L=3&L1=100001&L2=200010&old=LPE&old=LPE&old=LPE&old=LPE&old=LPE&old=LPE&old=LPE&atozmode=LPE"	"Service Search"	"Service Search Skip to start of page content Text | Home | A to Z | Feedback | Complaints | Your Council | Business | Residents | Visitors | Search A to Z home Homepage Letter Search Word Search Searc"	"24:jPfj+OVxoHbAqXj1kyVUvyqDni98K8ZZMZM4eLeP:jyhHbA8j1hmaqv/y5eLeP"	"10150d5eb4907ce93417e6ac0041b813"
"2009-12-16T15:32:16Z"	"http://wiki.cambridge-quakers.org.uk/index.php?title=Special:Recentchanges&hideliu=1&limit=100&hidepatrolled=1&from=20091216140013"	"Recent changes - CambridgeQuakerWiki"	"Recent changes - CambridgeQuakerWiki Recent changes From CambridgeQuakerWiki Track the most recent changes to the wiki on this page. Below are the changes since 14:00, 16 December 2009 (up to 100 show"	"24:I5dCoSK5IHl875TM9SMnLxbaKn4q0dnkeQ7JJ6:hy7unLxOXq0B3"	"ad84ae0ec3df1f1f0bd43d92de282425"
"2009-12-02T07:38:57Z"	"http://www.btplc.com/Societyandenvironment/Businessgame/nonflash/finale.asp?astr=caccabcaa&name=&company=&surname=&week=10"	"BT Better Business Game"	" ? Better Business Game ? How has done in first year as CEO of ? Sitting at the back of the main conference room at we had a great view of 's face as reactions to an exciting first year as CEO became "	"24:NjzY+2n/J6zuH9i2Ev9oIVYrDqw/kj1EcNigi98tZHK/zud6CuHB2kvDEj6Crv:Nj8fC2EVoFuw/XY0Io5vDE+E"	"73cf1c79fd15b4881abeac7664a3da1e"
"2009-12-01T17:26:27Z"	"http://www.beep.ac.uk/content/11+M571fe1ddee8.0.html?&pg=1&type=0&uid=52"	"BEEP BioEthics Education Project: Glossary"	"BEEP BioEthics Education Project: Glossary Jump to main content | Jump to main menu | Jump to top menu | ? Home?I?Teachers?I?About BEEP?I?Contact Us?I?Site Map?I?Admin?I? You are here: ?Home?>?Glossar"	"48:dHzbML+hjG3Tem2sM1W0A4ghtsJ2jPmxPR:tPML+Kym2R1W0oBuPR"	"e5443a74f62c7ddbbc0c0f8a4a61e77b"
"2009-03-16T05:52:26Z"	"http://www.faber.co.uk/tags/genre/Popular%20Music/2/?book_results_only=true&book_results_only=true&book_results_only=true&book_results_only=true&book_results_only=true&book_results_only=true&book_results_only=true&book_results_only=true&book_results_only=true&book_results_only=true&book_results_only=true&book_results_only=true&book_results_only=true&book_results_only=true&book_results_only=true&book_results_only=true&book_results_only=true"	"Faber & Faber : Search Results"	"Faber & Faber : Search Results Jump to the main navigation Jump to the main content of the page Faber & Faber Search Site Search Advanced Search Home Search Popular Music E-mail Newsletters Sign Up Lo"	"48:bGDAIU6P2MlZBPlg00Zo0ePCZegG2ZkJJ4SjnYS8BnOCr78nYjWpNWirITfy/3/0:bmtt0fn6CSjYSanZtWNWbfo3M"	"b1a80086b8a426d6d0210d95a8493c07"
"2009-10-21T14:45:53Z"	"http://www.geograph.org.uk/photo/35273"	"Hartland: Beckland Bay:: OS grid SS2826 :: Geograph British Isles - photograph every grid square!"	"Hartland: Beckland Bay:: OS grid SS2826 :: Geograph British Isles - photograph every grid square! Geograph - photograph every grid square SS2826 : Hartland: Beckland Bay 3 km from Hartland, Devon, Gre"	"24:sWfPWx4RXJBsAMIaf9FjYZlxYKMvH1rdIUJQdtN:sWfPW+ZJBspgqKMVrdIUJQdD"	"34006facf2969d0a55b1e781ade90a6d"
"2009-10-16T16:46:44Z"	"http://www.geograph.org.uk/sitemap/SW/64/7/SW656453.html"	"Photos in SW6545 :: Geograph British Isles"	"Photos in SW6545 :: Geograph British IslesGeograph British Isles Homepage | Sitemap | Up one level | Photos in SW6545 :: Geograph British Isles SW6545 :: Portreath harbour by Martin Southwood SW6545 :"	"6:qN25icc25D2hN925bCHdwRUq0uF2pqPMxHX02nynCHNF2pf2HALF:qNzn9jd9qb4dfn1NCxF"	"97cd10d40b9807ca056a89f65e8a36d6"
"2009-01-29T06:37:36Z"	"http://www.socialistworker.co.uk/article.php?article_id=8848"	"Northumbria lecturers to strike against pay attack|20May06|Socialist Worker"	"Northumbria lecturers to strike against pay attack|20May06|Socialist Worker Skip to content latest edition back issues > 2009 2008 2007 2006 2005 2004 2003 2002 2001 2000 1999 online reports subscribe"	"48:Ia+sMv+cq2C0BTrDeXpK2ylCWFsD3okYqq1HauTZ2hmQi7tv8tGa8u0yI+JVkVLG:Ia+sUmB0pDUHvYqq16xtG/dAie+EpxiG"	"42a1c73cd6a2ee62df6311ed1d9b235b"
"2009-04-14T21:03:50Z"	"http://www.order-order.com/2007/06/17/"	"2007 June 17 - Guy Fawkes' blog"	"2007 June 17 - Guy Fawkes' blog Order Order Guy News Merchandise About Sunday, June 17, 2007 Stand Up, Speak Up Progressives! The Tories are taking their Policy Review recommendations on the road arou"	"96:PLtb3CXWN8qdZeqbArjbpj6aN2KO0mQ01vl2neIfiwOz0XAvb0Vtd6:PLF3CXWZZeC4nUBKOTvYv7mA4"	"7e6f04979e06fa44622fe803ba590c6e"
"2009-09-07T21:19:56Z"	"http://www.rheumatoid.org.uk/medical_forum/faq.php?sid=05c1ae66b646c8fb7e2d63d3dd36a27f"	"Health Professionals? Forum :: FAQ"	"Health Professionals? Forum :: FAQ Health Professionals? Forum ? ? ? ? Help ? Search ? Profile ? Log in Health Professionals? Forum Forum Index FAQ Login and Registration Issues Why can't I log in? Wh"	"384:8oNeiaLyNV1C2CHWvn/s/QuiR7iurmqjBSTs:0Ui69/7AqjoQ"	"8491924bf880a2ee76063b4ed1374cf5"
"2009-05-20T14:02:57Z"	"http://rdoc.org.uk/eve/forums/a/tpc/f/66510549/m/52110359?r=43110359"	"RDOC Website - Milestones - Topic Powered by Eve For Enterprise"	"RDOC Website - Milestones - Topic Powered by Eve For Enterprise ?Return to main web site (leave the Online Support Group)?|?To support the Mouth Cancer Foundation, you can now make online donations! ?"	"192:hSVRGYj6yvjMZLiqIYafb3DAGOqGtD9LyL6q6wKELqYB9W5a0tfFGAGZ/iKiYj4M:mMCe9LQNOELDW5hsZpsL6/7qMD"	"e5ccaf0e2c1643879e54d06911f9caf3"
"2009-06-09T22:04:16Z"	"http://www.geolsoc.org.uk/gsl/op/prev%3C/info/photos?view=displayimage&xpid=4&pos=257"	"Photo Library - Geoscientists at work/A drilling site, Oman"	"Geological Society - Photo Library Skip to content Home Contact Us Site Map FAQs Shopping Basket Login / My GSL Search The Society This section is not expanded Publications This section is not expande"	"24:KDejlxlzZEMOKkcs1GpBGglEXlclAhltUQlnigW3DlwDmXPVUnDPyx:K6H9bpx0QYLyRw8dUux"	"9c5b0e7fbf62dd08eebe6927d2141c41"
"2009-06-08T15:22:12Z"	"http://www.sinnfeineu.com/en/press-centre/email/223"	"E-mail article: Conditions at Eglish National School in Ahascragh, County Galway, are Completely Unacceptable for Teachers and Children | Sinn F?in EU Election Headquarters"	"E-mail article: Conditions at Eglish National School in Ahascragh, County Galway, are Completely Unacceptable for Teachers and Children | Sinn F?in EU Election Headquarters Contact us Join Sinn F?in E"	"12:PJ+FjLA2DLJOoMQeR05fyt+FjLA2DLJOoMQeaw7Jg++qbUf/rJcQM2mXrSyV:AF3A2DLGRQfTF3A2DLGaydbUL2LV"	"1e2783a4e080b2dcba80988205558f22"
"2009-01-09T17:57:25Z"	"http://newhamstory.com/forums/index.php/topic,124.msg387.html?board=12.0"	"ALF STILL"	"ALF STILL ?The Newham Story?Support?About the Forums ?ALF STILL Username: 1 Hour 1 Day 1 Week 1 Month Forever Password: Home Help Search? Quick Search ? Advanced Search Login Register News: Welcome to"	"48:iMu5OmIGNRt/jG3siu4W73v4TEeN/5g/iwNw:sOmLTt/esuW73v4TZGfu"	"89757c659fe873da2df3aa84b005d778"
"2009-07-24T09:58:47Z"	"http://www.bl.uk/erecruitment/whatwedoeis2.html"	"Jobs at the British Library - E Strategy and Information systems - Profile 2"	"Jobs at the British Library - E Strategy and Information systems - Profile 2 Main | Why join us? | What we do | Our benefits | Vacancies and how to apply | My account E Strategy and Information system"	"48:DiAzTxMaqgRQz5zKZvAaDtpNCVg5o2L1Z1C3uBjqXqb3w:DT2HIwYSgbUhxz6bg"	"68d25645c9570f14b6ed11083b23cd4e"
"2009-04-13T19:46:57Z"	"http://wales.gov.uk/splash?orig=/docrepos/40382/epc/ecm/40382/reg_sellers_buyers_first_sa1.pdf"	"Llywodraeth Cynulliad Cymru | The Welsh Assembly Government"	"Llywodraeth Cynulliad Cymru | The Welsh Assembly Government Llywodraeth Cynulliad Cymru Llywodraeth Cynulliad Cymru yw llywodraeth ddatganoledig Cymru. Cymraeg The Welsh Assembly Government The Welsh "	"6:+o/ayAYOtQMb/Fn+oP4oUJy0uxtjLqYOtQMb/FLAFTYOtQMb/FVRNlFyFsx:+1TYO9J+l3JyLxtjLqYO9J8TYO9JVRNx"	"e02393e9773eb436208e95bba7d5486c"
"2009-06-09T04:11:28Z"	"http://www.thepigsite.com/swinenews/vars/country/in/offset/50"	"The Pig Site - Latest News"	"The Pig Site - Latest News ?Other 5M Publishing sites ? AboutVideos DownloadsEvents RecipesPhotosJobsConsultantsEmail to FriendSEARCH decrease font size increase font size change type face bookmark th"	"96:3suDI6GrE2gMyFmvaXv5W4I1YYUlsgBKObqLjJqWVl48uVJwF:3sYlGY2ryFmvaXvG2l6Rrqm"	"2773ff943047ff5ed07fca7fb5912809"
"2009-10-30T04:07:15Z"	"http://www.cynulliadcymru.org/gethome/e-petitions-old/admissible-pet/p-03-203.htm"	"P-03-203"	"P-03-203 Cynulliad Cenedlaethol Cymru Hyrgyrchedd | A-Y | Map o'r wefan Cymorth | Fy nghyfrif [Jump to Contents] English Hafan Newyddion Amdanon Ni Busnes Aelodau Senedd Cymryd rhan Mynnwch Lais Y Cyn"	"24:nooaqjtLg7/tmj+cysqR3NZIdyv2hslqAwwRkf1hNNm76:nooa6g1mj+cb4sdy0PbfO76"	"8820e421f1899522e08baa51ff3a1aa1"
"2009-11-20T08:21:57Z"	"http://www.gibfocus.co.uk/imagegallery/stbern/image.php?id=13&thumb=yes"	"www.gibfocus.gi - Gibraltar's daily news service - 24 hours - Gibraltar"	"www.gibfocus.gi - Gibraltar's daily news service - 24 hours - Gibraltar GIBFOCUS PHOTO GALLERY (back to home page) Previous picture? |? Next picture? Picture number: 14 ?Picture name: DSC02611.jpg Tur"	"12:IQWoJ12vrtdq0C8YXTZPp/+UoZoNJ6/cWm4DmY6ATCMkU+:Ia2zDgXVB/+LZoN3Wj+"	"22e1361384b5659e42898abc7b4debb0"
"2009-11-22T05:53:17Z"	"http://www.ukbms.org/site140/2001.htm"	"UKBMS - Yearly counts"	"UKBMS - Yearly counts Home ? Sites ? Culvie Wood ? 2001 ? Culvie Wood: Counts for the year 2001 ? APR MAY JUN JUL AUG SEP Week no. ?1? ?2? ?3? ?4? ?5? ?6? ?7? ?8? ?9? 10 11 12 13 14 15 16 17 18 19 20 "	"24:7LhhmED+3IiIpKJ9FTSbCKyXewZ3q8b2+7L:fh4gpibJ95SByXewK+3"	"e13ab96c520ab899116eceb988d42df0"
"2009-01-18T17:09:23Z"	"http://www.wpp.com/wppedcream/2008/advertising_film_1a.html"	"Johannes Leonardo | Nomis Boots | Damn Boots"	"Johannes Leonardo | Nomis Boots | Damn Boots Introduction Advertising Film Print Outdoor Ambient Radio Promotion Direct Design & Branding Interactive Media Public Relations Research 360 ? Johannes Leo"	"12:t5cHxDnieGZNmIsxTC5cM07n5ODRvrJmp7SRIT:rcHxTiNxsxTqcr5orI1iy"	"23ce4e9ebc364a093dad518b4b736f22"
"2009-11-23T00:53:23Z"	"http://www.ukbms.org/(S(hmfe4lyu0ukzlm3h43ywfc45))/Site2662/species99.htm"	"UKBMS - List of sites where this species occurs"	"UKBMS - List of sites where this species occurs Home ? Sites ? Isle of Eigg ? Green-veined White ? Green-veined White at Isle of Eigg Brood 1 Brood 2 Insufficient information These charts shows nation"	"12:qQokAzAFLpexfqtwqG0J8ab9KqpXzb9Kqpk2CKyXeWR223sfKSlqb2MpLXZKK:yzUGPW9Kg/9Kgk2CKyXewZ3q8b2+7L"	"5551924e1a7408fb74c77e0edf7a029a"
"2009-10-13T03:31:36Z"	"http://www.ncm.org.uk/events.asp?CalendarDate=21/12/2010"	"Events"	"Events Discover... A Great Day Out Tel 01924 848806 FREE ENTRY Open daily from 10.00am till 5.00pm Quick Search: Click for advanced search Home Visitor Zone Museum and Library Zone Learning Zone Corpo"	"48:nSyAFvgl3b6gJ/yJ/M7fLfnhyvRAz/BUsLAmsUOuEAwyEOW43+L/Am/:nSyAF4l3b62UyzfnhyvRAbB6mZOuEAhc"	"090d030e9a0ecb353eb4db6550fbacca"
"2009-08-07T10:11:49Z"	"http://www.assemblywales.org/bus-home/bus-legislation/bus-leg-legislative-competence-orders/bus-legislation-lco-2009-no10/nafw_lc5-wl_consutlation/nafw_lc5_wllco_individual-reponses/nafw_lc5_wllco-34i.htm"	"nafw_lc5_wllco-34i"	"nafw_lc5_wllco-34i National Assembly for Wales Accessibility | A-Z | My Account [Jump to Contents] Cymraeg Home News About Us Business Business Notice Plenary meetings Committees Legislation Progress "	"24:yAtqXF9HQerq5f515hcGh8fLw9FYmwhdcYjEG1A80AgxLMnmqR2WozoEO5ch7XNm:yAEF1Qcq5f5V8jwrYvhDYKAm5mqRilO7"	"3511a0802da510a3dbcf63c0d067130f"
